{
 "schema": "pacer.plan",
 "version": 1,
 "plan": {
  "name": "10K starter plan",
  "revision": 1,
  "units": "km",
  "race": {
   "name": "10K",
   "distance_m": 10000,
   "date": null
  },
  "fitness": {
   "vdot": 45,
   "from": "template"
  }
 },
 "weeks": [
  {
   "week": 1,
   "start": null,
   "phase": "base",
   "test": true,
   "focus": "Test week: find your starting point on the course.",
   "target_km": 18.8,
   "days": [
    {
     "date": null,
     "day": "Mon",
     "sessions": [
      {
       "id": "0-0",
       "type": "rest",
       "title": "Rest",
       "distance_m": null,
       "duration_s": null,
       "reps": null,
       "zone": null,
       "pace_s_per_km": null,
       "km": 0,
       "hard": false,
       "notes": "Rest day. Recovery is when the training lands: the work you did adapts into fitness while you rest."
      }
     ]
    },
    {
     "date": null,
     "day": "Tue",
     "sessions": [
      {
       "id": "0-1",
       "type": "sub",
       "title": "Sub-threshold",
       "distance_m": null,
       "duration_s": null,
       "reps": {
        "count": 4,
        "length_m": 1300,
        "rest_s": 60
       },
       "zone": "subthreshold",
       "pace_s_per_km": 284,
       "km": 7.7,
       "hard": true,
       "notes": "4 × 1.3 km (about 6 min each)"
      }
     ]
    },
    {
     "date": null,
     "day": "Wed",
     "sessions": [
      {
       "id": "0-2",
       "type": "rest",
       "title": "Rest",
       "distance_m": null,
       "duration_s": null,
       "reps": null,
       "zone": null,
       "pace_s_per_km": null,
       "km": 0,
       "hard": false,
       "notes": "Rest day. Recovery is when the training lands: the work you did adapts into fitness while you rest."
      }
     ]
    },
    {
     "date": null,
     "day": "Thu",
     "sessions": [
      {
       "id": "0-3",
       "type": "strides",
       "title": "Easy + strides",
       "distance_m": 3000,
       "duration_s": null,
       "reps": null,
       "zone": "easy",
       "pace_s_per_km": 346,
       "km": 3,
       "hard": false,
       "notes": "3 km + 6 strides"
      }
     ]
    },
    {
     "date": null,
     "day": "Fri",
     "sessions": [
      {
       "id": "0-4",
       "type": "rest",
       "title": "Rest",
       "distance_m": null,
       "duration_s": null,
       "reps": null,
       "zone": null,
       "pace_s_per_km": null,
       "km": 0,
       "hard": false,
       "notes": "Rest day. Recovery is when the training lands: the work you did adapts into fitness while you rest."
      }
     ]
    },
    {
     "date": null,
     "day": "Sat",
     "sessions": [
      {
       "id": "0-5",
       "type": "rest",
       "title": "Rest",
       "distance_m": null,
       "duration_s": null,
       "reps": null,
       "zone": null,
       "pace_s_per_km": null,
       "km": 0,
       "hard": false,
       "notes": "Rest, or 15–20 minutes very easy with 4 strides: fresh legs for tomorrow's test."
      }
     ]
    },
    {
     "date": null,
     "day": "Sun",
     "sessions": [
      {
       "id": "0-6",
       "type": "test",
       "title": "Course test",
       "distance_m": 10000,
       "duration_s": null,
       "reps": null,
       "zone": "race",
       "pace_s_per_km": 271,
       "km": 13,
       "hard": true,
       "notes": "10 km time trial"
      }
     ]
    }
   ]
  },
  {
   "week": 2,
   "start": null,
   "phase": "base",
   "test": false,
   "focus": "Base: build the aerobic engine. Long sub-threshold reps, hill sprints, easy miles.",
   "target_km": 27.5,
   "days": [
    {
     "date": null,
     "day": "Mon",
     "sessions": [
      {
       "id": "1-0",
       "type": "rest",
       "title": "Rest",
       "distance_m": null,
       "duration_s": null,
       "reps": null,
       "zone": null,
       "pace_s_per_km": null,
       "km": 0,
       "hard": false,
       "notes": "Rest day. Recovery is when the training lands: the work you did adapts into fitness while you rest."
      }
     ]
    },
    {
     "date": null,
     "day": "Tue",
     "sessions": [
      {
       "id": "1-1",
       "type": "sub",
       "title": "Sub-threshold",
       "distance_m": null,
       "duration_s": null,
       "reps": {
        "count": 5,
        "length_m": 1300,
        "rest_s": 60
       },
       "zone": "subthreshold",
       "pace_s_per_km": 284,
       "km": 9,
       "hard": true,
       "notes": "5 × 1.3 km (about 6 min each)"
      }
     ]
    },
    {
     "date": null,
     "day": "Wed",
     "sessions": [
      {
       "id": "1-2",
       "type": "rest",
       "title": "Rest",
       "distance_m": null,
       "duration_s": null,
       "reps": null,
       "zone": null,
       "pace_s_per_km": null,
       "km": 0,
       "hard": false,
       "notes": "Rest day. Recovery is when the training lands: the work you did adapts into fitness while you rest."
      }
     ]
    },
    {
     "date": null,
     "day": "Thu",
     "sessions": [
      {
       "id": "1-3",
       "type": "sub",
       "title": "Sub-threshold",
       "distance_m": null,
       "duration_s": null,
       "reps": {
        "count": 2,
        "length_m": 2100,
        "rest_s": 90
       },
       "zone": "subthreshold",
       "pace_s_per_km": 289,
       "km": 6.7,
       "hard": true,
       "notes": "2 × 2.1 km (about 10 min each)"
      }
     ]
    },
    {
     "date": null,
     "day": "Fri",
     "sessions": [
      {
       "id": "1-4",
       "type": "rest",
       "title": "Rest",
       "distance_m": null,
       "duration_s": null,
       "reps": null,
       "zone": null,
       "pace_s_per_km": null,
       "km": 0,
       "hard": false,
       "notes": "Rest day. Recovery is when the training lands: the work you did adapts into fitness while you rest."
      }
     ]
    },
    {
     "date": null,
     "day": "Sat",
     "sessions": [
      {
       "id": "1-5",
       "type": "hillsprints",
       "title": "Easy + hill sprints",
       "distance_m": 4000,
       "duration_s": null,
       "reps": null,
       "zone": "easy",
       "pace_s_per_km": 346,
       "km": 4,
       "hard": false,
       "notes": "4 km easy + 7 × 10 s hill sprints"
      }
     ]
    },
    {
     "date": null,
     "day": "Sun",
     "sessions": [
      {
       "id": "1-6",
       "type": "long",
       "title": "Long run",
       "distance_m": 10000,
       "duration_s": null,
       "reps": null,
       "zone": "easy",
       "pace_s_per_km": 350,
       "km": 10,
       "hard": false,
       "notes": "10 km"
      }
     ]
    }
   ]
  },
  {
   "week": 3,
   "start": null,
   "phase": "base",
   "test": false,
   "focus": "Base: build the aerobic engine. Long sub-threshold reps, hill sprints, easy miles.",
   "target_km": 29.1,
   "days": [
    {
     "date": null,
     "day": "Mon",
     "sessions": [
      {
       "id": "2-0",
       "type": "rest",
       "title": "Rest",
       "distance_m": null,
       "duration_s": null,
       "reps": null,
       "zone": null,
       "pace_s_per_km": null,
       "km": 0,
       "hard": false,
       "notes": "Rest day. Recovery is when the training lands: the work you did adapts into fitness while you rest."
      }
     ]
    },
    {
     "date": null,
     "day": "Tue",
     "sessions": [
      {
       "id": "2-1",
       "type": "sub",
       "title": "Sub-threshold",
       "distance_m": null,
       "duration_s": null,
       "reps": {
        "count": 5,
        "length_m": 1300,
        "rest_s": 60
       },
       "zone": "subthreshold",
       "pace_s_per_km": 284,
       "km": 9,
       "hard": true,
       "notes": "5 × 1.3 km (about 6 min each)"
      }
     ]
    },
    {
     "date": null,
     "day": "Wed",
     "sessions": [
      {
       "id": "2-2",
       "type": "rest",
       "title": "Rest",
       "distance_m": null,
       "duration_s": null,
       "reps": null,
       "zone": null,
       "pace_s_per_km": null,
       "km": 0,
       "hard": false,
       "notes": "Rest day. Recovery is when the training lands: the work you did adapts into fitness while you rest."
      }
     ]
    },
    {
     "date": null,
     "day": "Thu",
     "sessions": [
      {
       "id": "2-3",
       "type": "sub",
       "title": "Sub-threshold",
       "distance_m": null,
       "duration_s": null,
       "reps": {
        "count": 3,
        "length_m": 2100,
        "rest_s": 90
       },
       "zone": "subthreshold",
       "pace_s_per_km": 289,
       "km": 8.8,
       "hard": true,
       "notes": "3 × 2.1 km (about 10 min each)"
      }
     ]
    },
    {
     "date": null,
     "day": "Fri",
     "sessions": [
      {
       "id": "2-4",
       "type": "rest",
       "title": "Rest",
       "distance_m": null,
       "duration_s": null,
       "reps": null,
       "zone": null,
       "pace_s_per_km": null,
       "km": 0,
       "hard": false,
       "notes": "Rest day. Recovery is when the training lands: the work you did adapts into fitness while you rest."
      }
     ]
    },
    {
     "date": null,
     "day": "Sat",
     "sessions": [
      {
       "id": "2-5",
       "type": "hillsprints",
       "title": "Easy + hill sprints",
       "distance_m": 4000,
       "duration_s": null,
       "reps": null,
       "zone": "easy",
       "pace_s_per_km": 346,
       "km": 4,
       "hard": false,
       "notes": "4 km easy + 9 × 10 s hill sprints"
      }
     ]
    },
    {
     "date": null,
     "day": "Sun",
     "sessions": [
      {
       "id": "2-6",
       "type": "long",
       "title": "Long run",
       "distance_m": 10000,
       "duration_s": null,
       "reps": null,
       "zone": "easy",
       "pace_s_per_km": 350,
       "km": 10,
       "hard": false,
       "notes": "10 km"
      }
     ]
    }
   ]
  },
  {
   "week": 4,
   "start": null,
   "phase": "base",
   "test": false,